{
  "schema_version": "rewireperform-feedback-intelligence-postread-evidence-v0.3.3",
  "contract_status": "SANITIZED_V0_3_3_ONE_SYNTHETIC_READ_CLOSED",
  "project_ref": "zbeswjipayspgvcipzmx",
  "generated_at": "2026-08-11T06:06:54.389127+00:00",
  "apple_rc_release_basis": "408b653953d2d9be7c29f8ada2924d7333746a62",
  "consumer_operator_commit": "d50b8967df8abd21cd581f752136ff5c3613a6ac",
  "request_id": "1502b081-854f-4758-ba5a-2717ab09a766",
  "accepted_pins": {
    "apple_rc_release_basis": "408b653953d2d9be7c29f8ada2924d7333746a62",
    "transfer_v0_2_1_acceptance_sha256": "9cd280b2e5ebe958237d6ba77e4f7c6f06217a5b0daf4897aea02c9c72396cfb",
    "export_schema_sha256": "e90eb3fc2ce717ef91ae35bcfcd5bc7944d3cc941faa8f071b42e934e967023d",
    "semantics_v0_3_3_acceptance_sha256": "a5563f83bcaef42d743ee898cdf02331d7965d18b88ab4ad431bde35f6176818",
    "semantics_manifest_sha256": "eccdf05956b68d457d3fc2135e3984d2b56242e4742fc3379152587bc5e7c33f",
    "semantics_package_sha256": "c5df75dd0ddbf717b039e1c809d9e06b06219b7e55e1d4384886a07496e210d5",
    "semantics_catalog_sha256": "f8a15bedd179c2f6dc4176a8296437e87b175d6e5747d8faa187154b8eee9c4a",
    "gateway_v0_2_1_v0_3_3_acceptance_sha256": "a2a236212b7e4e1f5c6ce323c9ddd9ee1b583f4f1974bcb251a33603f4a0f8d6",
    "gateway_manifest_sha256": "bc69e224b22e568269a74eff7d021533075dab931fb8adf6bc212f79a58d9f0e",
    "gateway_package_sha256": "5828858602b3a28374b6e11ea5c80649f908eef2f1c0527f1382a39d2b477ed0",
    "gateway_request_schema_sha256": "74e3616a67975766b51238d5573671d8e086014392d0e59e3ee9696ab287d204",
    "combined_predeploy_v0_2_acceptance_sha256": "cf352c7af509cd3ff1b61039e1437059d574697713e05b30e0cfa0224013554d",
    "combined_postdeploy_v0_2_acceptance_sha256": "0941fd066378e4e5ec16435dc2c789dde9476f9073e24921c695be49f6981164",
    "credentialless_preflight_v0_2_acceptance_sha256": "adcf46dbc00a5db16872b5ddf74fbe3a0dd86ddfabfa32917d7de1a857b373fd"
  },
  "network_request_count": 1,
  "data_scope": "synthetic",
  "consumer_result": {
    "http_status": 200,
    "validated_item_count": 825,
    "question_count": 55,
    "evidence_sha256": "ed2bca103ff657c3bd350616604264c722148c0d45a1a6fbfb1b27f7aa7fe79c",
    "raw_response_persisted": false,
    "raw_text_persisted": false,
    "subject_reference_persisted": false
  },
  "gate_close": {
    "consumer_pin_ready": false,
    "synthetic_export_enabled": false,
    "machine_credential_ready": false,
    "machine_gate": false,
    "production_gate": false,
    "production_export_enabled": false,
    "real_data_read_enabled": false,
    "feedback_collection_enabled": false,
    "text_collection_enabled": false,
    "minor_policy_enabled": false,
    "guardian_policy_enabled": false
  },
  "cleanup": {
    "secret_names_removed": [
      "MAHLEOS_FEEDBACK_INTELLIGENCE_MACHINE_KEY",
      "MAHLEOS_FEEDBACK_READER_DATABASE_URL",
      "MAHLEOS_FEEDBACK_INTELLIGENCE_MACHINE_GATE",
      "MAHLEOS_FEEDBACK_INTELLIGENCE_PRODUCTION_GATE"
    ],
    "secret_names_present_after_cleanup": [],
    "all_current_secret_names_absent": [
      "MAHLEOS_FEEDBACK_INTELLIGENCE_MACHINE_KEY",
      "MAHLEOS_FEEDBACK_INTELLIGENCE_MACHINE_KEY_PREVIOUS",
      "MAHLEOS_FEEDBACK_READER_DATABASE_URL",
      "MAHLEOS_FEEDBACK_INTELLIGENCE_MACHINE_GATE",
      "MAHLEOS_FEEDBACK_INTELLIGENCE_PRODUCTION_GATE"
    ],
    "reader_password_state": "NULL",
    "local_keychain_removal_required": true,
    "in_memory_secret_values_cleared": true,
    "synthetic_fixture_users": 0,
    "synthetic_fixture_rows": 0
  },
  "postread_audit": {
    "status": "PASS_V0_3_3_POSTREAD_ASSURANCE",
    "result_sha256": "79aa9190c4aa1fea7a85853b996e756899090eb3e76fa7fa4bb04ed39b4f2786",
    "reader_callable_function_count": 1,
    "reader_relation_privileges": [],
    "reader_sequence_privileges": [],
    "public_execute_defaults": [],
    "application_rows_read": false,
    "application_functions_called": false,
    "database_mutated": false
  },
  "production": false,
  "real_data_read": false
}
